{
  "$schema": "http://json-schema.org/draft-07/schema#",
  "$id": "https://github.com/Jatin17Solanki/protein-plate/schema/recipe.schema.json",
  "title": "Recipe",
  "description": "One recipe = one file data/recipes/<id>.json. All protein/kcal figures are per one person's portion (CONTEXT §4).",
  "type": "object",
  "additionalProperties": false,
  "required": [
    "id",
    "title",
    "source",
    "status",
    "meal_types",
    "main_proteins",
    "supporting_proteins",
    "tags",
    "dish_group",
    "variant_label",
    "per_portion",
    "stated_macros",
    "protein_working",
    "servings",
    "ingredients",
    "steps",
    "assumptions",
    "missing",
    "added_at"
  ],
  "properties": {
    "id": {
      "description": "Kebab-case, unique, equals the file name without .json. Never changes once published (links depend on it).",
      "type": "string",
      "pattern": "^[a-z0-9]+(-[a-z0-9]+)*$",
      "maxLength": 80
    },
    "title": {
      "type": "string",
      "minLength": 1,
      "maxLength": 120
    },
    "source": {
      "$ref": "#/definitions/Source"
    },
    "status": {
      "description": "incomplete = kept under its title with a missing[] list; never dropped.",
      "type": "string",
      "enum": [
        "complete",
        "incomplete"
      ]
    },
    "video_only": {
      "description": "The post has no written recipe; the video is the recipe (Jatin, 2026-10-20). Kept out of the review list; the app may list these separately.",
      "type": "boolean"
    },
    "meal_types": {
      "$ref": "#/definitions/MealTypes"
    },
    "main_proteins": {
      "description": "Every source supplying >= 35 % of the recipe's protein, larger contributor first. The first one sets the tile colour. Empty only when no protein group reaches 35 % — then flagged no_main_protein (CONTEXT §4: never invent one).",
      "type": "array",
      "items": {
        "$ref": "#/definitions/MainProtein"
      },
      "uniqueItems": true,
      "maxItems": 6
    },
    "supporting_proteins": {
      "description": "Ingredient ids (data/ingredients.json) that add protein but are not main proteins, e.g. greek_yogurt, cheese.",
      "type": "array",
      "items": {
        "$ref": "#/definitions/Slug"
      },
      "uniqueItems": true
    },
    "tags": {
      "description": "One flat set. Order matters: the first dish-type tag picks the tile icon.",
      "type": "array",
      "items": {
        "$ref": "#/definitions/Tag"
      },
      "uniqueItems": true
    },
    "dish_group": {
      "description": "Kebab-case id shared by intentional variants of one dish; null if none.",
      "anyOf": [
        {
          "type": "string",
          "pattern": "^[a-z0-9]+(-[a-z0-9]+)*$"
        },
        {
          "type": "null"
        }
      ]
    },
    "variant_label": {
      "description": "Short label that tells this version apart inside its dish group (e.g. 'with peas'). Required when dish_group is set.",
      "anyOf": [
        {
          "type": "string",
          "minLength": 1,
          "maxLength": 40
        },
        {
          "type": "null"
        }
      ]
    },
    "per_portion": {
      "$ref": "#/definitions/PerPortion",
      "description": "The creator's own numbers for one portion as they state it (is_estimate false). Null when the creator gives none — never our estimate (Jatin, 2026-10-20)."
    },
    "stated_macros": {
      "description": "Macros as the creator stated them, kept alongside our estimate; null if the creator gave none.",
      "anyOf": [
        {
          "$ref": "#/definitions/StatedMacros"
        },
        {
          "type": "null"
        }
      ]
    },
    "protein_working": {
      "description": "Show the working: one line per protein source, e.g. '40 g dry soya × 52 = 20.8 g'.",
      "type": "array",
      "items": {
        "type": "string",
        "minLength": 1
      }
    },
    "servings": {
      "description": "Portions the ingredient list makes, as the creator states it; null if not stated (then per_portion stays null and protein_working gives the whole-recipe total).",
      "anyOf": [
        {
          "type": "integer",
          "minimum": 1,
          "maximum": 20
        },
        {
          "type": "null"
        }
      ]
    },
    "ingredients": {
      "type": "array",
      "items": {
        "$ref": "#/definitions/Ingredient"
      }
    },
    "steps": {
      "description": "The creator's own words, in their order; only formatting changes (D5, revised 2026-10-20). When the caption has no method, the single step is the standard \"No written method — watch the video for the steps.\"",
      "type": "array",
      "items": {
        "type": "string",
        "minLength": 1
      }
    },
    "assumptions": {
      "description": "Anything we inferred (dry weight, portion count, meal type...). Fidelity check exceptions go here.",
      "type": "array",
      "items": {
        "type": "string",
        "minLength": 1
      }
    },
    "missing": {
      "description": "What the source does not give us. Must be non-empty when status is incomplete.",
      "type": "array",
      "items": {
        "type": "string",
        "minLength": 1
      }
    },
    "flags": {
      "description": "Things Jatin must look at (shown in the admin list). Set by scripts/data/check.ts (no_macros, macros_basis_unclear, missing_details) or by hand (source_conflict, other). Removed once he resolves them.",
      "type": "array",
      "items": {
        "$ref": "#/definitions/Flag"
      }
    },
    "added_at": {
      "type": "string",
      "format": "date"
    }
  },
  "allOf": [
    {
      "if": {
        "properties": {
          "status": {
            "const": "complete"
          }
        }
      },
      "then": {
        "properties": {
          "ingredients": {
            "type": "array",
            "minItems": 1
          },
          "steps": {
            "type": "array",
            "minItems": 1
          }
        }
      }
    },
    {
      "if": {
        "properties": {
          "status": {
            "const": "incomplete"
          }
        }
      },
      "then": {
        "properties": {
          "missing": {
            "type": "array",
            "minItems": 1
          }
        }
      }
    },
    {
      "if": {
        "properties": {
          "dish_group": {
            "type": "string"
          }
        }
      },
      "then": {
        "properties": {
          "variant_label": {
            "type": "string"
          }
        }
      }
    }
  ],
  "definitions": {
    "Slug": {
      "type": "string",
      "pattern": "^[a-z0-9]+(_[a-z0-9]+)*$"
    },
    "MainProtein": {
      "type": "string",
      "enum": [
        "paneer",
        "soya",
        "tofu",
        "tempeh",
        "pulses",
        "whey",
        "other"
      ]
    },
    "MealType": {
      "type": "string",
      "enum": [
        "breakfast",
        "lunch",
        "snack",
        "dinner"
      ]
    },
    "Tag": {
      "type": "string",
      "enum": [
        "sandwich_toast",
        "salad_bowl",
        "wrap_roll_taco",
        "kebab_tikki_cutlet",
        "chilla_pancake_omelette",
        "curry_sabzi",
        "rice_pulao_biryani",
        "pasta_noodles",
        "chaat",
        "paratha",
        "pizza",
        "dessert",
        "sauce_dip",
        "global",
        "quick",
        "air_fryer_required",
        "air_fryer_optional"
      ]
    },
    "Source": {
      "type": "object",
      "additionalProperties": false,
      "required": [
        "url",
        "platform",
        "creator",
        "creator_url",
        "ref"
      ],
      "properties": {
        "url": {
          "description": "Link to the original video/post. null only for the owner's own recipes.",
          "anyOf": [
            {
              "type": "string",
              "format": "uri",
              "pattern": "^https://"
            },
            {
              "type": "null"
            }
          ]
        },
        "platform": {
          "anyOf": [
            {
              "type": "string",
              "enum": [
                "instagram",
                "youtube",
                "website",
                "other"
              ]
            },
            {
              "type": "null"
            }
          ]
        },
        "creator": {
          "description": "Creator's display name or handle, credited on the recipe page.",
          "anyOf": [
            {
              "type": "string",
              "minLength": 1
            },
            {
              "type": "null"
            }
          ]
        },
        "creator_url": {
          "anyOf": [
            {
              "type": "string",
              "format": "uri",
              "pattern": "^https://"
            },
            {
              "type": "null"
            }
          ]
        },
        "ref": {
          "description": "Where the raw entry lives, e.g. 'batches/2026-10-16-batch1.txt#12' (private raw repo). null for recipes added another way.",
          "anyOf": [
            {
              "type": "string",
              "minLength": 1
            },
            {
              "type": "null"
            }
          ]
        }
      }
    },
    "MealTypes": {
      "type": "object",
      "additionalProperties": false,
      "required": [
        "values",
        "stated_by_user"
      ],
      "properties": {
        "values": {
          "description": "Multi-select. Empty for sauces/dips/marinades.",
          "type": "array",
          "items": {
            "$ref": "#/definitions/MealType"
          },
          "uniqueItems": true
        },
        "stated_by_user": {
          "description": "The subset of values the owner said; the rest were inferred.",
          "type": "array",
          "items": {
            "$ref": "#/definitions/MealType"
          },
          "uniqueItems": true
        }
      }
    },
    "NullableAmount": {
      "anyOf": [
        {
          "type": "number",
          "minimum": 0
        },
        {
          "type": "null"
        }
      ]
    },
    "PerPortion": {
      "type": "object",
      "additionalProperties": false,
      "required": [
        "protein_g",
        "kcal",
        "carbs_g",
        "fat_g",
        "fibre_g",
        "is_estimate"
      ],
      "properties": {
        "protein_g": {
          "anyOf": [
            {
              "type": "number",
              "minimum": 0,
              "maximum": 200
            },
            {
              "type": "null"
            }
          ]
        },
        "kcal": {
          "anyOf": [
            {
              "type": "number",
              "minimum": 0,
              "maximum": 3000
            },
            {
              "type": "null"
            }
          ]
        },
        "carbs_g": {
          "$ref": "#/definitions/NullableAmount"
        },
        "fat_g": {
          "$ref": "#/definitions/NullableAmount"
        },
        "fibre_g": {
          "$ref": "#/definitions/NullableAmount"
        },
        "is_estimate": {
          "description": "true = our calculation (see protein_working); false = creator's numbers used as is.",
          "type": "boolean"
        }
      }
    },
    "StatedMacros": {
      "type": "object",
      "additionalProperties": false,
      "required": [
        "basis",
        "protein_g",
        "kcal"
      ],
      "properties": {
        "basis": {
          "description": "As the creator put it, e.g. 'per serving', 'whole recipe'.",
          "type": "string",
          "minLength": 1
        },
        "protein_g": {
          "$ref": "#/definitions/NullableAmount"
        },
        "kcal": {
          "$ref": "#/definitions/NullableAmount"
        },
        "carbs_g": {
          "$ref": "#/definitions/NullableAmount"
        },
        "fat_g": {
          "$ref": "#/definitions/NullableAmount"
        }
      }
    },
    "Ingredient": {
      "type": "object",
      "additionalProperties": false,
      "required": [
        "item",
        "ingredient_id",
        "qty",
        "unit",
        "type",
        "as_written"
      ],
      "properties": {
        "item": {
          "description": "English name as shown on the recipe page.",
          "type": "string",
          "minLength": 1
        },
        "section": {
          "description": "Optional group heading, e.g. 'chutney'. Ingredients without one go in the main card. Keep a section's ingredients together.",
          "type": "string",
          "minLength": 1,
          "maxLength": 30
        },
        "ingredient_id": {
          "description": "Canonical id in data/ingredients.json (jeera -> cumin_seeds). null until the dictionary has it.",
          "anyOf": [
            {
              "$ref": "#/definitions/Slug"
            },
            {
              "type": "null"
            }
          ]
        },
        "qty": {
          "description": "Amount in `unit`; null for 'to taste' or unstated.",
          "$ref": "#/definitions/NullableAmount"
        },
        "unit": {
          "anyOf": [
            {
              "type": "string",
              "enum": [
                "g",
                "kg",
                "ml",
                "l",
                "tsp",
                "tbsp",
                "cup",
                "piece",
                "slice",
                "clove",
                "pinch",
                "handful",
                "to_taste"
              ]
            },
            {
              "type": "null"
            }
          ]
        },
        "grams": {
          "description": "Optional gram estimate when unit is not g (dry weight for dal/soya/pulses).",
          "$ref": "#/definitions/NullableAmount"
        },
        "type": {
          "type": "string",
          "enum": [
            "protein",
            "dairy",
            "grain",
            "produce",
            "spice",
            "pantry",
            "sauce"
          ]
        },
        "optional": {
          "description": "Creator marked it optional.",
          "type": "boolean"
        },
        "as_written": {
          "description": "The source's exact wording — the fidelity anchor.",
          "type": "string",
          "minLength": 1
        }
      }
    },
    "Flag": {
      "type": "object",
      "additionalProperties": false,
      "required": [
        "code",
        "note"
      ],
      "properties": {
        "code": {
          "type": "string",
          "enum": [
            "no_macros",
            "macros_basis_unclear",
            "missing_details",
            "no_main_protein",
            "source_conflict",
            "other"
          ]
        },
        "note": {
          "type": "string",
          "minLength": 1
        }
      }
    }
  }
}
