{
  "id": "fudgy-chocolate-protein-oats",
  "title": "Fudgy Chocolate Protein Oats",
  "source": {
    "url": "https://www.instagram.com/reel/DRtYRH0DKlp/",
    "platform": "instagram",
    "creator": "fit.khurana",
    "creator_url": "https://www.instagram.com/fit.khurana/",
    "ref": "batches/2026-10-21-batch2.txt#18"
  },
  "status": "complete",
  "meal_types": {
    "values": [
      "breakfast"
    ],
    "stated_by_user": [
      "breakfast"
    ]
  },
  "main_proteins": [
    "whey"
  ],
  "supporting_proteins": [
    "oats"
  ],
  "tags": [],
  "dish_group": null,
  "variant_label": null,
  "per_portion": {
    "protein_g": 38,
    "kcal": 430,
    "carbs_g": null,
    "fat_g": null,
    "fibre_g": null,
    "is_estimate": false
  },
  "stated_macros": {
    "basis": "whole recipe — one portion",
    "protein_g": 38,
    "kcal": 430,
    "carbs_g": null,
    "fat_g": null
  },
  "protein_working": [],
  "servings": 1,
  "ingredients": [
    {
      "item": "oats",
      "section": "coarse powder",
      "ingredient_id": "oats",
      "qty": 35,
      "unit": "g",
      "type": "grain",
      "as_written": "35g Oats"
    },
    {
      "item": "chia seeds",
      "section": "coarse powder",
      "ingredient_id": "chia_seeds",
      "qty": 7,
      "unit": "g",
      "type": "pantry",
      "as_written": "7g Chia seeds"
    },
    {
      "item": "cocoa powder",
      "section": "coarse powder",
      "ingredient_id": "cocoa_powder",
      "qty": 1,
      "unit": "tbsp",
      "type": "pantry",
      "as_written": "1 tbsp unsweetened cocoa powder"
    },
    {
      "item": "cinnamon",
      "section": "coarse powder",
      "ingredient_id": "cinnamon",
      "qty": 0.25,
      "unit": "tsp",
      "type": "spice",
      "optional": true,
      "as_written": "Cinnamon powder 1/4 tsp (optional)"
    },
    {
      "item": "sugar",
      "section": "coarse powder",
      "ingredient_id": "sugar",
      "qty": 0.25,
      "unit": "tsp",
      "type": "pantry",
      "as_written": "1/4 tsp sugar (sweetner)"
    },
    {
      "item": "salt",
      "section": "coarse powder",
      "ingredient_id": "salt",
      "qty": 1,
      "unit": "pinch",
      "type": "spice",
      "as_written": "Pinch of salt"
    },
    {
      "item": "whey protein",
      "section": "coarse powder",
      "ingredient_id": "whey_protein",
      "qty": 1,
      "unit": null,
      "grams": 30,
      "type": "protein",
      "as_written": "1 scoop protein"
    },
    {
      "item": "skimmed milk",
      "section": "coarse powder",
      "ingredient_id": "milk_skimmed",
      "qty": null,
      "unit": null,
      "type": "dairy",
      "as_written": "low fat milk"
    },
    {
      "item": "strawberries",
      "section": "coarse powder",
      "ingredient_id": "strawberries",
      "qty": null,
      "unit": null,
      "type": "produce",
      "as_written": "strawberries"
    },
    {
      "item": "Greek yogurt",
      "section": "coarse powder",
      "ingredient_id": "greek_yogurt",
      "qty": null,
      "unit": null,
      "type": "dairy",
      "as_written": "greek yogurt"
    },
    {
      "item": "honey",
      "section": "coarse powder",
      "ingredient_id": "honey",
      "qty": null,
      "unit": null,
      "type": "pantry",
      "as_written": "honey"
    },
    {
      "item": "peanut butter",
      "section": "coarse powder",
      "ingredient_id": "peanut_butter",
      "qty": 1,
      "unit": "tsp",
      "type": "pantry",
      "as_written": "1 tsp peanut butter"
    }
  ],
  "steps": [
    "Blend well and add half a glass of hot low fat milk little by little. Mixture should be fudgy like a cake batter and not milky. It will automatically cook due to the boiling hot milk.",
    "Top with fresh strawberries, a tbsp of greek yogurt (sweeteneed with honey) and 1 tsp peanut butter."
  ],
  "assumptions": [
    "The ingredient list also names zero-calorie sweetener as an alternative or note; it isn’t listed separately.",
    "The recipe makes one portion."
  ],
  "missing": [],
  "added_at": "2026-10-21",
  "flags": []
}
