{
  "id": "walnut-date-cocoa-bites",
  "title": "Walnut Date Cocoa Bites",
  "source": {
    "url": "https://www.instagram.com/reel/DM4il0sTKZ6/",
    "platform": "instagram",
    "creator": "fit.khurana",
    "creator_url": "https://www.instagram.com/fit.khurana/",
    "ref": "batches/2026-10-21-batch2.txt#82"
  },
  "status": "complete",
  "meal_types": {
    "values": [
      "snack"
    ],
    "stated_by_user": [
      "snack"
    ]
  },
  "main_proteins": [],
  "supporting_proteins": [
    "pumpkin_seeds",
    "cocoa_powder",
    "dates"
  ],
  "tags": [
    "dessert"
  ],
  "dish_group": null,
  "variant_label": null,
  "per_portion": {
    "protein_g": null,
    "kcal": null,
    "carbs_g": null,
    "fat_g": null,
    "fibre_g": null,
    "is_estimate": false
  },
  "stated_macros": null,
  "protein_working": [],
  "servings": null,
  "ingredients": [
    {
      "item": "walnuts",
      "ingredient_id": "walnuts",
      "qty": null,
      "unit": null,
      "type": "pantry",
      "as_written": "7/8 walnuts roasted"
    },
    {
      "item": "pumpkin seeds",
      "ingredient_id": "pumpkin_seeds",
      "qty": 2,
      "unit": "tbsp",
      "type": "pantry",
      "as_written": "2 tbsp pumpkin seeds roasted"
    },
    {
      "item": "dates",
      "ingredient_id": "dates",
      "qty": 6,
      "unit": "piece",
      "type": "produce",
      "as_written": "6-7 soft dates"
    },
    {
      "item": "cocoa powder",
      "ingredient_id": "cocoa_powder",
      "qty": 2,
      "unit": "tbsp",
      "type": "pantry",
      "as_written": "2 tbsp unsweetened cocoa powder"
    },
    {
      "item": "instant coffee",
      "ingredient_id": "instant_coffee",
      "qty": 0.5,
      "unit": "tbsp",
      "type": "pantry",
      "as_written": "1/2 tbsp coffee"
    },
    {
      "item": "salt",
      "ingredient_id": "salt",
      "qty": 1,
      "unit": "pinch",
      "type": "spice",
      "as_written": "Pinch of salt"
    },
    {
      "item": "vanilla extract",
      "ingredient_id": "vanilla_extract",
      "qty": 1,
      "unit": "tsp",
      "type": "pantry",
      "as_written": "1 tsp vanilla extract"
    },
    {
      "item": "milk",
      "ingredient_id": "milk",
      "qty": 3,
      "unit": "tbsp",
      "type": "dairy",
      "as_written": "3 tbsp milk"
    },
    {
      "item": "dark chocolate",
      "ingredient_id": "dark_chocolate",
      "qty": 2,
      "unit": "piece",
      "type": "pantry",
      "optional": true,
      "as_written": "2 squares dark chocolate (optional)"
    }
  ],
  "steps": [
    "Soak dates in hot water for 15 mins.",
    "Blend the soaked dates with all the above ingredients and add it to your bowl!",
    "Add melted dark chocolate on top and garnish with toasted chopped walnuts.",
    "Set in the fridge for 10 to 15 minutes, and it’s ready!! Also, be mindful while enjoying this. I would just eat half a portion because it’s higher on the calories side."
  ],
  "assumptions": [
    "The caption says “7/8 walnuts”; we read it as 7–8 walnuts."
  ],
  "missing": [],
  "added_at": "2026-10-21",
  "flags": [
    {
      "code": "no_macros",
      "note": "The creator gives no macros."
    },
    {
      "code": "no_main_protein",
      "note": "No protein source reaches 35 % of the protein (CONTEXT §4), so it has no main protein."
    }
  ]
}
